<?xml version="1.0" standalone="no"?>
<!DOCTYPE DAVEfunc SYSTEM "DAVEfunc.dtd">
<DAVEfunc>
  <fileHeader>

      <author name="Bruce Jackson" org="NASA Langley Research Center" xns="@bjax"/>
      <fileCreationDate date="01-MAR-2002"/>
      <description>
	 Coefficient of lift (non-dimensional) - single two-dimensional table.
	 Example file for DAVE function table format. This example is more complex.
      </description>

      <reference refID="REF01" author="Raney, David L." 
	      title="F-19A Basic Aerodynamics Model" 
	      accession="NASA TM-4302" date="July 1992"/>
      <reference refID="REF02" author="Buggati, Richard W."
	      title="F-19A Rotary Aerodynamics Model"
	      accession="NASA TM-4303" date="July 1993"
	      xlink:href="http://dcb.larc.nasa.gov/models/tm4303.pdf"/>
      <reference refID="REF03" author="Aviation Leak &amp; Space Tautology"
	      title="F-19A Falling Short on Design Performance Numbers"
	      accession="Vol. 45, Number 12" date="3-JUL-1993"/>

      <modificationRecord modID="A" refID="REF03">
	<author name="Hildrup, Bruce L." org="SAID Patuxent River">
	  <address>
	    1087 Exploration Parkway Ste 201
	    Lexington Park, MD 20654
	  </address>
	</author>
	<description>
	  Reversed sign on drag term for better performance!
	</description>
      </modificationRecord>

  </fileHeader>

      <!-- ================== -->
      <!--  Input variables   -->
      <!-- ================== -->

  <variableDef name="alpha" varID="ALPHA" units="deg" symbol="#x3B1">
    <description>
       Instantaneous true angle-of-attack, in degrees
    </description>
  </variableDef>

  <variableDef name="Mach" varID="MACH" units="ND" symbol="M"/>

      <!-- ================== -->
      <!--  Output variable   -->
      <!-- ================== -->

  <variableDef name="CL" varID="CL" units="ND" symbol="CL">
    <description>
      Coefficient of lift based on alpha and mach.
    </description>
  </variableDef>

      <!-- ================== -->
      <!--  Breakpoint values -->
      <!-- ================== -->

  <breakpointDef name="alpha" bpID="ALPHA1" units="deg">
      <description>
	 Alpha breakpoints for most basic aero data
      </description>
      <bpVals>
      -4.0, 0., 4.0, 8.0, 12.0, 16.0
      </bpVals>
  </breakpointDef>

  <breakpointDef name="mach" bpID="MACH1" units="ND">
    <bpVals>
      0.0, 0.4, 0.8, 0.9, 0.95, 0.99, 1.00, 1.01, 1.05, 1.2
    </bpVals>
  </breakpointDef>

      <!-- ================== -->
      <!--      Functions     -->
      <!-- ================== -->

  <function name="Basic CL">
    <description>
      Basic coefficient of lift table as a function of Mach and angle of attack
    </description>
    <provenance>
      <author name="Bruce Jackson" org="NASA Langley Research Center" xns="@bjax"/>
      <functionCreationDate date="Jul-1994"/>
      <documentRef refID="REF01"/>
      <documentRef refID="REF02"/>
      <modificationRef modID="A"/>
    </provenance>
    <independentVarRef varID="MACH" min="0.3" max="0.95" extrapolate="max"/>   <!-- Mach breakpoints -->
    <independentVarRef varID="ALPHA" min="0.0" max="15.0" extrapolate="both"/> <!-- Alpha breakpoints -->
    <dependentVarRef varID="CL"/>

    <functionDefn name="CL_FN">
      <griddedTable name="CL_TABLE">
	<breakpointRefs>
	  <bpRef bpID="MACH1"/>
	  <bpRef bpID="ALPHA1"/>
	</breakpointRefs>
	<confidenceBound value="95%"/>
	<dataTable> <!-- Note: last breakpoint changes most rapidly -->
 9.5013e-01   6.1543e-01   5.7891e-02   1.5274e-02   8.3812e-01   1.9343e-01
 2.3114e-01   7.9194e-01   3.5287e-01   7.4679e-01   1.9640e-02   6.8222e-01
 6.0684e-01   9.2181e-01   8.1317e-01   4.4510e-01   6.8128e-01   3.0276e-01
 4.8598e-01   7.3821e-01   9.8613e-03   9.3181e-01   3.7948e-01   5.4167e-01
 8.9130e-01   1.7627e-01   1.3889e-01   4.6599e-01   8.3180e-01   1.5087e-01
 7.6210e-01   4.0571e-01   2.0277e-01   4.1865e-01   5.0281e-01   6.9790e-01
 4.5647e-01   9.3547e-01   1.9872e-01   8.4622e-01   7.0947e-01   3.7837e-01
 1.8504e-02   9.1690e-01   6.0379e-01   5.2515e-01   4.2889e-01   8.6001e-01
 8.2141e-01   4.1027e-01   2.7219e-01   2.0265e-01   3.0462e-01   8.5366e-01
 4.4470e-01   8.9365e-01   1.9881e-01   6.7214e-01   1.8965e-01   5.9356e-01
	</dataTable>
      </griddedTable>
    </functionDefn>
  </function>
</DAVEfunc>    




