<?xml version="1.0" standalone="no"?>
<!DOCTYPE DAVEfunc SYSTEM "DAVEfunc.dtd">
<DAVEfunc>
    <fileHeader>
        <author name="Bruce Jackson" org="NASA Langley Research Center" xns="@bjax"/>
        <fileCreationDate date="11-MAR-2002"/>
        <description>
	    Coefficient of lift (non-dimensional) versus angle-of-attack, deg.
	    Example file for DAVE function table format. This example is the simplest version.
	</description>
    </fileHeader>
    <function name="CL">
	<independentVarPts>
	  -4.0, 0., 4.0, 8.0, 12.0, 16.0
	</independentVarPts>
        <dependentVarPts>
	  0.0, 0.2, 0.4, 0.8, 1.0, 1.2
        </dependentVarPts>
    </function>
</DAVEfunc>
